question,a,b,c,d,correct
Is it ethical to collect user data without clearly explaining how it will be used?,Yes,No,Only for research,Depends,No
Should an organisation disclose a mistake even if it damages its reputation?,Always,Never,Only if discovered,Depends,Always
Is it acceptable to use biased data if it improves efficiency?,Yes,No,Only temporarily,Depends,No
Should employees challenge decisions they believe are unethical?,Always,Never,Only privately,Depends,Always
Is it ethical to prioritise speed over accuracy in decision-making?,Yes,No,Only in emergencies,Depends,Only in emergencies
Should AI systems be explainable to users?,Yes,No,Only to regulators,Depends,Yes
Is it acceptable to ignore minor ethical concerns to achieve a positive outcome?,Yes,No,Sometimes,Depends,No
Should organisations be held accountable for unintended consequences of their actions?,Yes,No,Only legally,Depends,Yes